Priority,Action Item,Deadline,Status,Details
URGENT,Confirm or release Hilton Garden Inn rooms,March 2 2026,Pending,Hold on 6 rooms expires - confirm booking or release
HIGH,Follow up with Toftrees Resort,,Pending,Earlier outreach - no reply yet - groupsales@toftrees.com
HIGH,Follow up with Graduate State College,,Pending,Earlier outreach - no reply yet - info@graduatestatecollege.com
HIGH,Follow up with PSU Central Reservations,,Pending,Earlier outreach - no reply yet - reservations@psu.edu
HIGH,Ask Dawn Nixon about Hyatt Place / Courtyard / Residence Inn,,Pending,Scholar Hotels reply only mentioned Penn Stater - need rates for other 3 properties - dnixon@scholarhotels.com
MEDIUM,Wait for Feb 14 email replies (8 hotels),,Pending,"Carnegie House, SpringHill Suites, Hyatt Place, Courtyard, Residence Inn, Fairfield Inn, Days Inn, Quality Inn"
LOW,Verify Days Inn location,,Pending,240 S. Pugh St appears CLOSED - active location is 1274 N. Atherton